"utterance","context","maxim","violation_type"
"Yeah I wonder what he didn't tell OP about the move, maybe lied to his mom about OP that painted her in a bad light?","He didn't tell either one of us the full truth about the move, and was trying to keep the heat off of him""  Wow thats a huge red flag. He has to put in some major work to repairing this loss of trust.  Is he going to throw you under the bus in the future? Is he going to tell you and others half truths so he doesn't have to deal with it? How often does he normally lie to you or those around him?  If he uses lying as a self defense mechanism, it can be unlearned if he cares enough. Good luck.","Cooperative","none"
"That stood out to me too. We have a pretty good idea of not the full truth he told his mom, but what wasn’t he honest about with Op?","He didn't tell either one of us the full truth about the move, and was trying to keep the heat off of him""  Wow thats a huge red flag. He has to put in some major work to repairing this loss of trust.  Is he going to throw you under the bus in the future? Is he going to tell you and others half truths so he doesn't have to deal with it? How often does he normally lie to you or those around him?  If he uses lying as a self defense mechanism, it can be unlearned if he cares enough. Good luck.","Cooperative","none"
"Thank you!","Always link to the original post. https://www.reddit.com/r/AmItheAsshole/s/OBxs5i2rGk","Cooperative","none"
"Basically telling me he was ready for the move and excited about it and telling his mom the complete opposite he didn’t exactly lie to his mom but told half truths he wouldn’t tell her the full story.","What did he not tell either of you and what was his reasoning? Was it cowardice?","Cooperative","none"
"Its been two years with no respect. Just throw it over the ledge. Its not your problem. Then call and complain to the building manager that someone is littering. Might solve your problem.","I would start throwing it over the ledge, or putting some of the items onto communal property.  NTA","Cooperative","none"
"This is the way. As far as anyone knows they flew off the window and down to the courtyard for all to see.   Maybe even then let the building agency know and let them know who are the littering tenants.","Chuck it off your balcony and suddenly it won’t be your problem anymore.","Cooperative","none"
"yes, I want to believe it's been an accident all this time, but how come they're still doing the same thing 2 years later? I would be so embarrassed to be bothering my neighbour if I knew my personal belongings was falling into their house.","NTA.   I'm not completely convinced that it's all accidental, who puts empty cleaning bottles, clothes, and trash close enough to the window for them to be blown or knocked out? Now, the first couple times, it could genuinely have been an accident, but for it to be happening for TWO YEARS? And they haven't changed anything nor come to pick their belongings up themselves? Absolutely not.","Cooperative","none"
"OP shouldn’t have said it was fine. OP needs to use their voice and said it is not ok. After that, then I blame the neighbors","EVERYTHING i aquire due to THEIR negligence, goes into the garbage. Screw those people.","Cooperative","none"
"fair observation. I agree with you that I think i could've been more honest and say that I wasn't okay with this from the beginning, but at the time I didn't think it would happen as frequent. I appreciate your response.","ESH. If you were expecting them to do better, you should have said that to them the first time (or any time) this happened. Instead you told them it was no problem at all. They should be more respectful of your space, but you should be more respectful of your own boundaries too and tell them that you won’t tolerate their trash on your balcony.","Cooperative","none"
"I don't understand this either. I can understand the clothes by the window, the wind could've pushed them over. But the trash bags and empty cleaning products? I don't understand.","Wait trash bags they are throwing their trash on your balcony NTA","Cooperative","none"
"This. The reactive dog and their owner should cross the street.","If her dog can’t behave around other dogs then she should be the one to cross the street. NTA","Cooperative","none"
"I have a dog aggressive dog that is like 100lbs.  I always keep my eyes open for other dogs who are out to make sure I can avoid them.  Seems like common sense to me.","NTA. imo the rule is, the person with the aggressive dog should be the one to move out of the way","Cooperative","none"
"My dog barks at other dogs on walks. I always cross the street or at least move as far to the side as I can if crossing is not an option. And then I tell him to look at how calm the other dog is and learn something 😆","NTA - you said it was her dog that started growling. She should have moved if her dog gets ""annoyed"" when other dogs get near.","Cooperative","none"
"Right, plus if the rule is that everyone crosses the street when they see another person with a dog, then they both should have crossed and ended up on the same side again anyway","NTA. There’s no social convention that I’m aware of that you’re supposed to cross the street when you see another person with a dog. Also how would that work if there were three dogs on the same block, hardly an unheard of situation. She’s just making things up.","Quality","flouting"
"Yes, and that is why he doesn't want to have to stand up for him as a witness. He probably envisions that part of his past being used against him.","Absolutely NTA, but it feels like that complaint against your BIL may have been legitimate...  I'm so sorry that happened to you.","Cooperative","none"
"This seems like the most likely scenario and one that sister is least likely to want to acknowledge as truth. She is deceiving herself and trying to pull you along for the ride as to what is going on in her own relationship. As personal as I’m sure it feels, she is just trying to hold onto the lie that is keeping her sane right now.","NTA is it one of ‘those’ places?   Not to put stories in your head but is it possible that your BIL brought you there knowing that it was? Like maybe he thinks you’d feel/be better if you ‘let off a little steam’ as they say   I have a hard time believing that a trained previously licensed massage therapist would pay for you to have a massage somewhere else when he could do that for you himself if the sole intent is just a massage","Cooperative","none"
"Honestly, I don’t think there’s a problem with naming a witness, especially if the appointment was in their name.  Regardless of whether he wanted to be a witness/involved, he was.  That’s the risk you take when you act as an intermediary.  I think the bigger problem is that he might choose to not back up OP’s story if called.","NTA for reporting, and you didn't need permission for that, but you should have gotten his consent before naming him. So very slightly YTA for that.   However, his reaction was over the top and very, very gross. Unfortunately, he sounds like an SA apologist and your sister sounds like an enabler. And hella passive aggressive, too.","Cooperative","none"
"She says she named him as an outcry witness. As in, she came out of the room and told him what happened immediately. That does make him a witness.","You should not have named him as a witness without asking him.  He also was not a witness since he wasn't in the room.  So, for that part, YTA.  You are NTA for reporting behavior that made you uncomfortable.","Cooperative","none"
"I’m confused; how am I abusing therapy-speak?  I’m also a licensed counselor with over 12 years experience.","YTA to your family for abusing therapy speak. Your complaints about the LMT is justified, file a complaint if you want but don’t expect anyone else to participate.","Cooperative","none"
"If I got a call asking if I could help change out a tire and I was in the middle of playing a game with friends, I would have rounded up the boys, turned the game off and we would have gone to her to figure it all out together. Damn a game, my gf is on the side of the road alone and in pain.","Hes not obligated to fix your tire even though it would have been nice.   By the same token you're not obligated to remain his girlfriend if you would rather date someone who has your back. If I was your boyfriend I would have shown up with my friends and helped you out, because my friends are amazing and I choose to remain friends with people who share my values. values.  Edit: NTA","Cooperative","none"
"And she’s not obligated to reply to his text right away. If he was so worried he could have been there","Hes not obligated to fix your tire even though it would have been nice.   By the same token you're not obligated to remain his girlfriend if you would rather date someone who has your back. If I was your boyfriend I would have shown up with my friends and helped you out, because my friends are amazing and I choose to remain friends with people who share my values. values.  Edit: NTA","Cooperative","none"
"I had a very similar situation to this just last weekend, and me and my friends jumped in a car and went and picked my girlfriend up from her broken down car. One of my friends even waited with her car for it to be recovered.  OPs bf doesn't have his priorities straight and sounds like a deadbeat.","Hes not obligated to fix your tire even though it would have been nice.   By the same token you're not obligated to remain his girlfriend if you would rather date someone who has your back. If I was your boyfriend I would have shown up with my friends and helped you out, because my friends are amazing and I choose to remain friends with people who share my values. values.  Edit: NTA","Cooperative","none"
"never even thought of this, thank you","Water is too cold so bacteria can't digest the body and give off gas from digestion to cause the body to float","Cooperative","none"
"Especially when the skies of November turn gloomy","Water is too cold so bacteria can't digest the body and give off gas from digestion to cause the body to float","Quality","flouting"
"Tahoe is the same. Too cold and too deep","Water is too cold so bacteria can't digest the body and give off gas from digestion to cause the body to float","Cooperative","none"
"This. On Lake Superior we had to pay attention to coast guard alerts for unjacketed overboards or “Pon Pon” emergencies. Had to find them quick before they sunk. It is 200-400 feet deep in the islands and you would never find them after that.","Water is too cold so bacteria can't digest the body and give off gas from digestion to cause the body to float","Cooperative","none"
"the inverse is why it’s harder to keep fish fresh, their bacteria can take the cold","Water is too cold so bacteria can't digest the body and give off gas from digestion to cause the body to float","Cooperative","none"
"This hits close to home, they just found the body of a college kid that went missing a couple months ago in my town, on Lake Superior. It was presumed he fell through the ice in the harbor late one night. I’m so glad they found him for closure for the family. Never turn your back on water or mountains!","Waters in Lake Superior are cold enough that the bacteria responsible for decomposing bodies doesnt exist. Absent the decomposition and the gas byproduct there is nothing to cause bodies to be buoyant .","Cooperative","none"
"thank you for this, that makes a lot of sense. super eerie to me personally","Waters in Lake Superior are cold enough that the bacteria responsible for decomposing bodies doesnt exist. Absent the decomposition and the gas byproduct there is nothing to cause bodies to be buoyant .","Cooperative","none"
"Think of it like fermentation in a human cask.","Waters in Lake Superior are cold enough that the bacteria responsible for decomposing bodies doesnt exist. Absent the decomposition and the gas byproduct there is nothing to cause bodies to be buoyant .","Manner","flouting"
"The bacteria that decompose your body are already inside your body, it's just too cold for them to function","Waters in Lake Superior are cold enough that the bacteria responsible for decomposing bodies doesnt exist. Absent the decomposition and the gas byproduct there is nothing to cause bodies to be buoyant .","Cooperative","none"
"did they find preserved bodies at bottom of the lake?","Waters in Lake Superior are cold enough that the bacteria responsible for decomposing bodies doesnt exist. Absent the decomposition and the gas byproduct there is nothing to cause bodies to be buoyant .","Cooperative","none"
"So nothing takes advantage of that niche ecosystem? Do those protein and fats just go to waste?","Waters in Lake Superior are cold enough that the bacteria responsible for decomposing bodies doesnt exist. Absent the decomposition and the gas byproduct there is nothing to cause bodies to be buoyant .","Cooperative","none"
"Global warming raising the temperature of that lake a few degrees could make things reeeeally creepy.","Waters in Lake Superior are cold enough that the bacteria responsible for decomposing bodies doesnt exist. Absent the decomposition and the gas byproduct there is nothing to cause bodies to be buoyant .","Cooperative","none"
"yes i’m understanding that now! thank you","first we need to know why dead bodies typically float - gas from rotting. Typically the bacteria in your digestive tract start to decompose your body and produce a lot of gas as a by product, which causes remains to swell/inflate, become less dense, and float like a balloon.  Now for why some don’t in the Great Lakes, the deeper lakes, famously Lake Superior, are very very cold. So cold that that bacteria actually dies and doesn’t start creating gas, so the bodies just sink","Cooperative","none"
"When the skys of November turn gloomy","The lake, it is said, never gives up her dead.","Quality","flouting"
"WOAH I can’t wait to study this! thanks, I love shipwrecks! tragic but very interesting and full of things to learn","There is a wreck deep in Lake Superior off Isle Royale *with bodies still in it*, 100 years after it sank.   [https://en.wikipedia.org/wiki/SS\_Kamloops](https://en.wikipedia.org/wiki/SS_Kamloops)","Cooperative","none"
"Well, at least until the fish get to them.  Eventually, there is little left of them.","Lake Superior is too cold. The bodies don't decompose, bloat, and float to the surface. They stay frozen at the bottom of the lake.","Quality","flouting"
"so crazy to think about, thank you for the insight","Lake Superior is too cold. The bodies don't decompose, bloat, and float to the surface. They stay frozen at the bottom of the lake.","Cooperative","none"
"While this isn’t a correct answer I had to upvote you for the “Dead people generally don’t swim.”   Nice","Dead people generally don't swim. If they're in the ship when it goes down, that's where they stay. If they're outside the ship, and can float up, they probably didn't drown, and if they do, they're already at the surface.","Manner","flouting"
"BASED REFERENCE","Under the waves and the earth of an age  Lie a thousand old northerners' graves  Deep in the night when the moon's glowing bright  They come rising up into the night","Cooperative","none"
"Also, if you claim you have more muscle mass than someone benching 125kg while only being capable of doing 60 then I can very safely bet that a big chunk of OP's volume is fat, water, etc... and their actual musculature is much less than they think","Most likely he doesn't have less muscle mass than you. Largely, strength = muscle mass but it is a nervous system adaption as well so someone who looks a little smaller can be stronger.","Cooperative","none"
"Sounds like an optimization issue? I recall seeing this show where huge bodybuilders struggle with lifting cement bags, while construction workers 1/3 of their size would carry them with ease.","Most likely he doesn't have less muscle mass than you. Largely, strength = muscle mass but it is a nervous system adaption as well so someone who looks a little smaller can be stronger.","Cooperative","none"
"Yeah that's why bodybuilders are just as good at powerlifting as powerlifters.  /s","Most likely he doesn't have less muscle mass than you. Largely, strength = muscle mass but it is a nervous system adaption as well so someone who looks a little smaller can be stronger.","Quality","flouting"
"What OP thinks is muscle is probably intramuscular fat. Also up to a point strength scales pretty rapidly with more time spent lifting.","You currently bench 60 kg and you believe you have more muscle mass?","Cooperative","none"
"That's  a plate per side.  I'm sorry op, I'm older and coming back from injury and I rep my starting weight at this.    If your doing 60kg (and young) you're still in the beginner phase of muscle","You currently bench 60 kg and you believe you have more muscle mass?","Cooperative","none"
"I think this is what they call Bronning Kruger? When a gymbro is too dumb to realize that he doesn't have the muscle mass and strength he thinks. It's well known for its dumb-bell graph.  I bet he also coaches people at the gym.","You currently bench 60 kg and you believe you have more muscle mass?","Quality","flouting"
"The creatine is inflating his ego.","You currently bench 60 kg and you believe you have more muscle mass?","Quality","flouting"
"He said *appears* to have more muscle mass.","You currently bench 60 kg and you believe you have more muscle mass?","Cooperative","none"
"***nonfunctional hypertrophy","You currently bench 60 kg and you believe you have more muscle mass?","Manner","flouting"
"I assumed OP was 12-13","You currently bench 60 kg and you believe you have more muscle mass?","Cooperative","none"
"I'd say they are correlated but do not imply causality.","Strength and mass are not proportinately correlated, that's why body builders aren't always strong, and why strongmen don't look like body builders. You'd need to focus on training strength rather than muscle mass to be strong and lean.","Cooperative","none"
"How do you train strength?","Strength and mass are not proportinately correlated, that's why body builders aren't always strong, and why strongmen don't look like body builders. You'd need to focus on training strength rather than muscle mass to be strong and lean.","Cooperative","none"
"Body builders are strong.","Strength and mass are not proportinately correlated, that's why body builders aren't always strong, and why strongmen don't look like body builders. You'd need to focus on training strength rather than muscle mass to be strong and lean.","Quality","violating"
"On the lean side you have rock climbers. Look like twigs but can lift a shit ton. Muscle density and  fiber thickness vs muscle mass and fiber quantity.","Strength and mass are not proportinately correlated, that's why body builders aren't always strong, and why strongmen don't look like body builders. You'd need to focus on training strength rather than muscle mass to be strong and lean.","Cooperative","none"
"Yup, everyone always overestimates how much muscle they have and underestimates how much fat they have. Cutting 20lb just to find you have another 20lb to lose is a meme for a reason.","To put it bluntly, you are fat. You have less muscle than you think you do. They are lean, they have more total muscle mass than you. Muscle is denser and thus take up less space on the body than fat. They may look less muscular but they have more than you.","Cooperative","none"
"&gt;Sarcoplasmic vs myofibrilar hypertrophy.  Appreciate the reply but this aint an ELI5 opener, cmon.","Sarcoplasmic vs myofibrilar hypertrophy. Training to increase size vs training to increase strength. Id rather shake hands with a bodybuilder than a rock climber, little bastard will crush your hand like a coke can.","Cooperative","none"
"&gt;More muscle mass does not make you stronger, it just means you have more muscle  LOL","Strength is about muscle fiber density, not muscle mass. More muscle mass does not make you stronger, it just means you have more muscle.   Edit: I should have worded that better. Adding muscle mass does add strength. What I meant was one individual having more muscle mass than another individual does not make the one with more mass stronger. This is because muscle fiber density is much more strongly correlated to strength than muscle mass alone","Quality","flouting"
"This analogy helped me understand it better. Thank you!","Your blood is mostly water. Your saliva is mostly water. Each of your trillions of cells that make up your meat, nerves, brain, etc contain mostly water.   A great way to visualize this is to make beef jerky. If you put 1lb of beef in a dehydrator, youll get back a few ounces of jerky. The only thing that happened in the dehydrator is the water evaporated.","Cooperative","none"
"&gt; A great way to visualize this is to make beef jerky. If you put 1lb of beef in a dehydrator, youll get back a few ounces of jerky. The only thing that happened in the dehydrator is the water evaporated.   And if you're a Japanese scientist not bound by international agreements on how to treat prisoners of war, and you're wondering what the percentage is for people...","Your blood is mostly water. Your saliva is mostly water. Each of your trillions of cells that make up your meat, nerves, brain, etc contain mostly water.   A great way to visualize this is to make beef jerky. If you put 1lb of beef in a dehydrator, youll get back a few ounces of jerky. The only thing that happened in the dehydrator is the water evaporated.","Quality","flouting"
"So, if we put a human in a dehydrator we should only get a few pounds after?","Your blood is mostly water. Your saliva is mostly water. Each of your trillions of cells that make up your meat, nerves, brain, etc contain mostly water.   A great way to visualize this is to make beef jerky. If you put 1lb of beef in a dehydrator, youll get back a few ounces of jerky. The only thing that happened in the dehydrator is the water evaporated.","Quality","flouting"
"Which is also why jerky is so goddamn expensive","Your blood is mostly water. Your saliva is mostly water. Each of your trillions of cells that make up your meat, nerves, brain, etc contain mostly water.   A great way to visualize this is to make beef jerky. If you put 1lb of beef in a dehydrator, youll get back a few ounces of jerky. The only thing that happened in the dehydrator is the water evaporated.","Relation","flouting"
"Damn so I’m just a bag of water and meat?","Your blood is mostly water. Your saliva is mostly water. Each of your trillions of cells that make up your meat, nerves, brain, etc contain mostly water.   A great way to visualize this is to make beef jerky. If you put 1lb of beef in a dehydrator, youll get back a few ounces of jerky. The only thing that happened in the dehydrator is the water evaporated.","Quality","flouting"
"Just like how a sponge holds water it’s in everything","Your blood is mostly water. Your saliva is mostly water. Each of your trillions of cells that make up your meat, nerves, brain, etc contain mostly water.   A great way to visualize this is to make beef jerky. If you put 1lb of beef in a dehydrator, youll get back a few ounces of jerky. The only thing that happened in the dehydrator is the water evaporated.","Cooperative","none"
"Anything organic that doesn't crack when bent... Is wet. Dry it out then try bending it!   Even that beef Jerry has a bit of water left. Freeze dry it and it'll crumble to dust... Depending on the cut, you might be able to make someggross meat rope out of it...","Your blood is mostly water. Your saliva is mostly water. Each of your trillions of cells that make up your meat, nerves, brain, etc contain mostly water.   A great way to visualize this is to make beef jerky. If you put 1lb of beef in a dehydrator, youll get back a few ounces of jerky. The only thing that happened in the dehydrator is the water evaporated.","Cooperative","none"
"I want a meat RE-HYDRATER - got too much jerky chew, I want my meat back!","Your blood is mostly water. Your saliva is mostly water. Each of your trillions of cells that make up your meat, nerves, brain, etc contain mostly water.   A great way to visualize this is to make beef jerky. If you put 1lb of beef in a dehydrator, youll get back a few ounces of jerky. The only thing that happened in the dehydrator is the water evaporated.","Quality","flouting"
"Humans are 30% beef jerky.","Your blood is mostly water. Your saliva is mostly water. Each of your trillions of cells that make up your meat, nerves, brain, etc contain mostly water.   A great way to visualize this is to make beef jerky. If you put 1lb of beef in a dehydrator, youll get back a few ounces of jerky. The only thing that happened in the dehydrator is the water evaporated.","Quality","flouting"
"Inside cells, interlinked.","It’s in a lot of places, but mostly what people mean is that it’s inside your cells. All that flesh you can see doesn’t look like mummified beef jerky because it’s full like a water balloon. Also your blood is a lot of water.","Manner","flouting"
"thinking back to elementary school, our cells do not have cell walls","Blood is mostly water.  But more importantly, [your cells](https://en.wikipedia.org/wiki/Cell_(biology)) are little sacks of water with various stuff floating around inside them.  The whole point of a cell wall (the outer layer) is to keep it all in, so it doesn't just float away and the things inside can bump into each other and do their jobs.","Quality","violating"
