"utterance","context","maxim","violation_type"
"The weather is nice today.","Why were you late to the meeting?","Relation","unknown"
"Have you tried the new coffee place?","Did you finish the report?","Relation","unknown"
"My cat did the funniest thing yesterday.","Can we talk about the budget?","Relation","unknown"
"I hear it might rain tomorrow.","Are you going to apologize?","Relation","unknown"
"That's a nice shirt.","Did you read my email?","Relation","unknown"
"How about those playoffs?","We need to discuss your performance review.","Relation","unknown"
"I'm thinking about getting a new plant.","When are you going to pay me back?","Relation","unknown"
"I had cereal for breakfast.","What time should we schedule the standup?","Relation","unknown"
"My sister lives in Portland.","Have you submitted the pull request yet?","Relation","unknown"
"Oh that reminds me, I need to buy milk.","So what's the plan for the migration?","Relation","unknown"
"Some students passed.","Did everyone pass the exam?","Quantity","flouting"
"I've been to a country or two.","Have you traveled much?","Quantity","flouting"
"She's not the worst singer.","What did you think of her performance?","Quality","flouting"
"Well, where do I even begin. So first I woke up at 6:47, not 6:45 like usual, and then I brushed my teeth for exactly two minutes...","How was your morning?","Manner","flouting"
"He has a pulse.","How's the new intern doing?","Quantity","flouting"
"There were some issues.","How did the deployment go?","Quantity","flouting"
"Yes.","Can you walk me through how the authentication flow works?","Quantity","flouting"
"It was okay I guess.","Can you give me detailed feedback on my presentation?","Quantity","flouting"
"Well the thing is we started the project in January and at first we were thinking about using React but then someone suggested Vue and we had a whole meeting about it and then...","What framework did you end up using?","Manner","flouting"
"Oh sure, I LOVE waiting in line for three hours.","How do you feel about the DMV?","Quality","flouting"
"I've told you a million times.","Can you remind me of the password?","Quality","flouting"
"He's a real Einstein.","What do you think of the new hire?","Quality","flouting"
"My heart literally exploded.","How was the concert?","Quality","flouting"
"Yeah and I'm the Queen of England.","I finished the entire project last night.","Quality","flouting"
"That went well.","The presentation crashed halfway through and the client left.","Quality","flouting"
"The capital of Australia is Sydney.","What's the capital of Australia?","Quality","violating"
"I'm pretty sure the meeting is at 3.","When is the meeting? It's at 2.","Quality","violating"
"That word means happy.","What does 'lugubrious' mean?","Quality","violating"
"It's a mammal.","Is a penguin a mammal?","Quality","violating"
"Shakespeare wrote it in the 1800s.","When was Hamlet written?","Quality","violating"
"Antibiotics should clear that right up.","I've had this cold for a few days. It's viral.","Quality","violating"
"I may or may not have potentially been in a situation where something could have occurred.","What happened?","Manner","flouting"
"The thing with the stuff at the place.","What are you talking about?","Manner","flouting"
"First I did step 3, then step 1, then I went back to step 2.","How did you assemble the shelf?","Manner","flouting"
"She performed a series of bilateral contractions of the orbicularis oculi muscles.","What did she do?","Manner","flouting"
"It's not not possible that it's not untrue.","Is this correct?","Manner","flouting"
"So basically the thing is that it's like when you have the situation where it's not working.","What's the bug?","Manner","flouting"
"I need the report but not the one from last week the other one with the graphs but not the pie charts.","Which report do you need?","Manner","flouting"
"We should do it before after the meeting.","When should we deploy?","Manner","flouting"
"The function returns the thing that the other function needs to do the thing.","How does this code work?","Manner","flouting"
"I'm not at liberty to discuss that.","What happened in the board meeting?","Quantity","opting_out"
"I'd rather not say.","How much do you make?","Quantity","opting_out"
"No comment.","Did you know about the layoffs before they were announced?","Quantity","opting_out"
"Someone told me it might be in building C but I'm not sure.","Where is the exam?","Quality","flouting"
"I think she's upset but I don't want to put words in her mouth.","How does Sarah feel about the reorg?","Quantity","flouting"
"I heard a rumor but I really shouldn't repeat it.","What's going on with the Johnson account?","Quantity","flouting"
"The meeting is at 3pm in room 204.","When and where is the meeting?","Cooperative","none"
"I finished the report and sent it to Sarah.","What did you do today?","Cooperative","none"
"Yes, I'll be there.","Can you make it to dinner tonight?","Cooperative","none"
"It costs forty-five dollars.","How much is it?","Cooperative","none"
"I left them on the kitchen counter.","Have you seen my keys?","Cooperative","none"
"No, I haven't heard from her since Tuesday.","Have you talked to Maria?","Cooperative","none"
"The train arrives at 5:15.","When does the train get here?","Cooperative","none"
"It's three blocks north on the left side of the street.","How do I get to the pharmacy?","Cooperative","none"
"We're using PostgreSQL 15 with PostGIS.","What database are you running?","Cooperative","none"
"I disagree — I think we should go with option B because it's cheaper.","Should we go with option A?","Cooperative","none"
"Oh I forgot to mention, the printer is broken.","Can you review this PR by end of day?","Relation","unknown"
"My dog is three years old.","What's the status on the API migration?","Relation","unknown"
"I think the cafeteria closes at 2.","Have you seen the error logs from last night?","Relation","unknown"
"We should really organize the supply closet.","What's our Q3 revenue forecast?","Relation","unknown"
"The parking lot was full this morning.","Did the database backup complete?","Relation","unknown"
"Fine.","Can you tell me everything that happened at the client meeting?","Quantity","flouting"
"Good.","How did the surgery go? We've been worried sick.","Quantity","flouting"
"So anyway after that meeting which was on a Tuesday I think or maybe Wednesday and Sarah was there and also possibly Mark though he might have left early and we discussed the thing about the budget which reminded me of last quarter when we had that other budget issue...","Did they approve the proposal?","Manner","flouting"
"Things.","What did you buy at the store?","Quantity","flouting"
"It went.","How was your first day at the new job? Tell me everything!","Quantity","flouting"
"The deliverable is to be completed by the stakeholder in alignment with the synergistic framework.","What do I actually need to do?","Manner","flouting"
"So like the thing is you go there and then you do that and then the other thing happens.","How do I set up the development environment?","Manner","flouting"
"It's in the place where we put the thing last time we did the thing.","Where's the backup drive?","Manner","flouting"
"You need to not un-disable the setting.","How do I turn on notifications?","Manner","flouting"
"The meeting got rescheduled to before when it was after.","When is the meeting now?","Manner","flouting"
"Oh great, another meeting. Just what I needed.","We have a sync at 4.","Quality","flouting"
"Wow, you're so fast.","Sorry it took me three weeks to reply to your email.","Quality","flouting"
"What a surprise.","The deploy failed again.","Quality","flouting"
"Breaking news: water is wet.","Did you know the project is over budget?","Quality","flouting"
"Sure, and pigs fly.","I'll definitely have it done by Friday.","Quality","flouting"
"It's on the second shelf in the supply room.","Where do we keep the printer paper?","Cooperative","none"
"I sent it to the team yesterday around 3pm.","Did you share the meeting notes?","Cooperative","none"
"Python 3.11 with FastAPI.","What's the tech stack for the new service?","Cooperative","none"
"About forty-five minutes if traffic is normal.","How long is the drive?","Cooperative","none"
"She said she'd have it ready by Thursday.","When is the design review?","Cooperative","none"
"Two years, mostly on the backend.","How long have you been on this team?","Cooperative","none"
"No, we decided to go with the vendor option instead.","Are we building it in-house?","Cooperative","none"
"It's in the shared drive under Q3 Reports.","Where can I find last quarter's numbers?","Cooperative","none"
"Did you see the game last night?","We need to talk about your attendance.","Relation","unknown"
"I wonder what's for lunch.","Have you thought about what I said?","Relation","unknown"
"Anyway, how's your mom doing?","Are you going to sign the divorce papers?","Relation","unknown"
"Look, a squirrel!","Can you explain why the tests are failing?","Relation","unknown"
"You know what I love about this office? The lighting.","Did you take the money from petty cash?","Relation","unknown"
"Speaking of which, have you been to that new Thai place?","So about the missing inventory...","Relation","unknown"
"Isn't it someone's birthday this week?","When are you going to finish the migration?","Relation","unknown"
"I really need to clean my desk.","What did you say to the client?","Relation","unknown"
"It's not terrible.","What do you think of my thesis?","Quantity","flouting"
"I've read a book or two on the subject.","Are you qualified for this?","Quantity","flouting"
"We've had some feedback.","How did the users react to the redesign?","Quantity","flouting"
"There have been... developments.","What happened while I was on vacation?","Quantity","flouting"
"I have thoughts.","What do you think about the CEO's new strategy?","Quantity","flouting"
"Not everyone was thrilled.","How did the team take the news?","Quantity","flouting"
"I've seen worse.","How's the code quality on this legacy project?","Quantity","flouting"
"Parts of it were interesting.","Did you like the movie?","Quantity","flouting"
"Oh absolutely, I live for spreadsheets.","Can you update the tracking sheet?","Quality","flouting"
"Clearly I'm the problem here.","The server crashed after your deploy.","Quality","flouting"
"Because that worked so well last time.","Let's try the same approach again.","Quality","flouting"
"I'm drowning in free time.","Can you take on one more project?","Quality","flouting"
"Oh no, my heart bleeds for you.","I only got a 15% raise this year.","Quality","flouting"
"What a tragedy.","The vending machine is out of chips.","Quality","flouting"
"I'm sure it'll be a page-turner.","We have a new compliance document to review.","Quality","flouting"
"Right, because that's totally how databases work.","Can't we just delete the duplicates?","Quality","flouting"
"The Great Wall of China is visible from space.","Can you see it from up there?","Quality","violating"
"Humans only use 10% of their brains.","Why can't I remember anything?","Quality","violating"
"Lightning never strikes the same place twice.","Should we worry about that tree?","Quality","violating"
"It takes seven years to digest gum.","I accidentally swallowed my gum.","Quality","violating"
"We lose most of our body heat through our heads.","Should I bring a hat?","Quality","violating"
"Goldfish have a three-second memory.","Do you think the fish recognizes me?","Quality","violating"
"Cracking your knuckles causes arthritis.","Can you stop doing that?","Quality","violating"
"You should wait 30 minutes after eating to swim.","Can we go to the pool now?","Quality","violating"
"In a manner of speaking, through a lens of contextual reframing, one might suggest it was suboptimal.","How was the meeting?","Manner","flouting"
"Step 1: don't. Step 2: see step 1.","How should I respond to this angry email?","Manner","flouting"
"It's like that thing, but the other way, and also sideways.","Can you describe the architecture?","Manner","flouting"
"The answer is yes, no, and it depends, in that order.","Should we launch on Monday?","Manner","flouting"
"Let me put it this way: imagine a duck.","Can you explain the billing system?","Manner","flouting"
"It's not not a problem, but it's not a not-problem either.","Is this a bug?","Manner","flouting"
"Think of it as aggressively adequate.","How would you rate the contractor's work?","Manner","flouting"
"Chronologically? Alphabetically? By emotional intensity?","What happened today?","Manner","flouting"
"So the thing with the API is that it does the thing when you call it but sometimes it doesn't do the thing and then you have to do the other thing.","What's wrong with the API?","Manner","flouting"
"I put it over there by the thing next to where we had the meeting about the stuff.","Where did you put the contract?","Manner","flouting"
"Yeah so basically you just kind of do it and then it works or it doesn't.","How do I configure the load balancer?","Manner","flouting"
"The issue is related to the implementation of the functionality pertaining to the user-facing interface.","What's the bug?","Manner","flouting"
"First you do the last part, then skip to the middle, then do the beginning.","How do I file an expense report?","Manner","flouting"
"It's like email but not email, more like a message but not a text.","What platform should I use to contact them?","Manner","flouting"
"The system does what it does when it does it.","Can you document how the cron job works?","Manner","flouting"
"We need to leverage the synergies of the cross-functional paradigm shift.","What's the plan for next quarter?","Manner","flouting"
"Three bugs, all in the auth module.","What did you find in the code review?","Cooperative","none"
"Sure, I'll send it over after lunch.","Can you share the slide deck?","Cooperative","none"
"It's a React app with a Node backend.","What are we building?","Cooperative","none"
"Tuesday at 2pm works for me.","When can we meet to discuss the roadmap?","Cooperative","none"
"I'd recommend the salmon.","What's good here?","Cooperative","none"
"About 200 lines, mostly tests.","How big is the PR?","Cooperative","none"
"She's on PTO until next Wednesday.","Is Sarah available for a meeting?","Cooperative","none"
"Version 3.2, released last month.","What version of the SDK are you using?","Cooperative","none"
"It's a known issue, fix is in the next release.","Why does the export keep failing?","Cooperative","none"
"Yep, merged it this morning.","Did the hotfix go out?","Cooperative","none"
"Chicken parm, if they still have it.","What do you want for lunch?","Cooperative","none"
"I think we should wait for the test results first.","Should we ship this today?","Cooperative","none"
"The deadline is March 15th.","When is the proposal due?","Cooperative","none"
"It's the third door on the right, past the kitchen.","Where's the conference room?","Cooperative","none"
"About 12 milliseconds per request.","What's the average latency?","Cooperative","none"
"No, that was deprecated in version 4.","Does the old endpoint still work?","Cooperative","none"
"So I started watching this new show last night.","Can we talk about what happened at Thanksgiving?","Relation","unknown"
"Have you noticed the new art in the lobby?","Why didn't you cc me on that email?","Relation","unknown"
"I should really start going to the gym.","Are you going to address the complaint?","Relation","unknown"
"This coffee is actually pretty good today.","Did you tell HR about the incident?","Relation","unknown"
"Oh hey, is that a new phone?","We need to discuss your expenses.","Relation","unknown"
"I was thinking about taking up pottery.","What did the auditors say?","Relation","unknown"
"You know what, I've never been to Iceland.","Can you explain this charge on the company card?","Relation","unknown"
"The sunset was gorgeous yesterday.","Why were the servers down for six hours?","Relation","unknown"
"I think I'm going to repaint my kitchen.","Have you told the client about the delay?","Relation","unknown"
"Did you know octopuses have three hearts?","When are you going to respond to legal?","Relation","unknown"
"My neighbor got the cutest puppy.","We need your incident report by end of day.","Relation","unknown"
"I've been really into sourdough lately.","What happened to the production database?","Relation","unknown"
"We had a conversation.","What did the investors say about the pitch?","Quantity","flouting"
"It could have gone better.","How did your driving test go?","Quantity","flouting"
"I have some concerns.","What do you think of the merger?","Quantity","flouting"
"Well, it exists.","Have you seen the new website design?","Quantity","flouting"
"Let's just say there were surprises.","How was the product launch?","Quantity","flouting"
"People had feelings.","How did the layoffs go?","Quantity","flouting"
"It was... an experience.","How was the team offsite?","Quantity","flouting"
"Some things were said.","What happened in the meeting with the CEO?","Quantity","flouting"
"I wouldn't say no.","Do you want to grab dinner?","Quantity","flouting"
"There's room for improvement.","How did I do on the presentation?","Quantity","flouting"
"Not nothing happened.","Did anything come of the investigation?","Quantity","flouting"
"Mistakes were made.","What went wrong with the release?","Quantity","flouting"
"I may or may not have seen your keys.","Have you seen my keys?","Quantity","flouting"
"The report is fine.","Is the report ready?","Manner","flouting"
"Some students passed the exam.","Did all students pass?","Quantity","flouting"
"It is possible the meeting is at 3pm.","When is the meeting?","Quality","violating"
"I think Paris is in Germany.","Where is Paris?","Quality","violating"
"I arrived at the station.","Where have you been?","Cooperative","none"
"She left.","Where did she go?","Cooperative","none"
"Yeah.","Can you explain what went wrong with the deployment?","Quantity","violating"
"It's fine.","Can you give me a detailed status update on the project?","Quantity","violating"
"Stuff.","What did you work on this sprint?","Quantity","violating"
"So basically what happened was I got to the office around 8:47 and then I opened my laptop and it took about three minutes to boot which is longer than usual and then I opened Slack and I had 47 messages and the first one was from Dave and he said...","Did the client approve the contract?","Manner","violating"
"We talked about some things and made some decisions.","Can you send me the meeting minutes?","Quantity","violating"
"I fixed it.","What was the root cause of the outage and what did you change?","Quantity","violating"
"There were people there and we discussed topics.","How was the conference?","Quantity","violating"
"I sent an email.","What steps have you taken to resolve the customer complaint?","Quantity","violating"
"So the thing is that when I was in college I took this one class and the professor said something about databases and that's actually how I first got into programming which is why I think we should...","Should we use SQL or NoSQL for this?","Manner","violating"
"Good.","Can you walk me through your analysis of the Q3 numbers?","Quantity","violating"
"I made changes.","What exactly did you push to production?","Quantity","violating"
"It didn't work so I tried something else and then it worked.","Can you document what you did to fix the authentication bug?","Quantity","violating"
"React is a programming language.","What framework are you using?","Quality","violating"
"The sprint ends on Friday.","When does the sprint end? It ends Wednesday.","Quality","violating"
"That's a GET request.","Why is this POST endpoint failing?","Quality","violating"
"Python is statically typed.","Why do I need type hints?","Quality","violating"
"We have about fifty employees.","How big is the company? We have three hundred.","Quality","violating"
"The API rate limit is 10,000 requests per second.","Why am I getting throttled at 100 per minute?","Quality","violating"
"That meeting is optional.","Can I skip the all-hands? No — attendance is mandatory.","Quality","violating"
"I'm pretty sure that's covered under our insurance.","Is this expense reimbursable? No — it's explicitly excluded.","Quality","violating"
"The repo is public.","Can anyone see this code? No — it's a private repo.","Quality","violating"
"CSS is a programming language.","What languages do you know?","Quality","violating"
"The deadline was extended to next month.","When is this due? It was moved up to this Friday.","Quality","violating"
"That function is O(1).","Why is this so slow? The function is O(n²).","Quality","violating"
"Oh I meant to tell you the elevator was weird this morning.","So what's the verdict on the vendor contract?","Relation","unknown"
"I think the font on the homepage looks off.","Can we prioritize the security vulnerabilities?","Relation","unknown"
"Did anyone else notice the AC is broken?","We're here to discuss the quarterly roadmap.","Relation","unknown"
"My commute was terrible today.","What's our strategy for the product launch?","Relation","unknown"
"I just realized I forgot to water my plants.","Have you reviewed the pull request I tagged you on?","Relation","unknown"
"The lunch options here are really limited.","Can we go over the test results?","Relation","unknown"
"Has anyone tried that new smoothie place?","We need to finalize the budget allocations.","Relation","unknown"
"I keep getting spam calls lately.","What did the client say about the revised timeline?","Relation","unknown"
"My laptop charger is fraying.","Can we talk about the deployment schedule?","Relation","unknown"
"I think they changed the parking rules.","What's the status on the data migration?","Relation","unknown"
"So the thing is basically it's not not working but it's also not fully like operational in the way that you'd want.","Is the feature ready to ship?","Manner","violating"
"I did the thing with the config and then the other config and changed the setting to the other setting.","What did you change in the environment?","Manner","violating"
"It's like when you have the thing and it does the thing but then the other thing happens instead.","Why is the build failing?","Manner","violating"
"We should maybe potentially consider possibly looking into that at some point.","Are we going to fix the accessibility issues?","Manner","violating"
"The data goes from the first thing to the second thing and then it gets processed by the third thing.","Can you explain the data pipeline?","Manner","violating"
"I updated the code in the file in the folder in the repo.","Where did you make the change?","Manner","violating"
"The meeting is about the thing we discussed at the other meeting about the previous thing.","What's tomorrow's meeting about?","Manner","violating"
"So you click the button and then you go to the screen and then you click the other button and then something happens.","How do I use the new feature?","Manner","violating"
"The error is happening because of the way the system handles the process when the condition is met.","What's causing the 500 errors?","Manner","violating"
"I think we need to do the thing before the other thing but after the first thing unless the third thing happens first.","What's the order of operations for the release?","Manner","violating"
"It's in the place where we keep the things for the project.","Where's the style guide?","Manner","violating"
"The issue is that the component renders when it shouldn't and doesn't render when it should but sometimes it renders when it should but not the way it should.","What's the bug?","Manner","violating"
"The bug was in the auth middleware — a null check was missing on the session token. I added the check and wrote a regression test.","What caused the login failures?","Cooperative","none"
"We're two days ahead of schedule. The API integration finished early and QA starts tomorrow.","How's the project tracking?","Cooperative","none"
"I'd suggest PostgreSQL for this. The data is highly relational and we need ACID compliance for the transaction processing.","What database should we use?","Cooperative","none"
"Three candidates looked strong. I've scheduled second rounds for Monday and Tuesday with the hiring panel.","How did the interviews go?","Cooperative","none"
"Oh fantastic, another all-hands meeting. My absolute favorite.","How do you feel about the company update tomorrow?","Quality","flouting"
"Right, because traffic in SF is always such a dream.","You seem stressed. Long commute?","Quality","flouting"
"Sure, I'll just whip up a complete redesign by end of day. Totally realistic.","Can we get the new UI done by EOD?","Quality","flouting"
"Wow, what a thorough code review. Very actionable.","The review just said ""looks good.","Quality","flouting"
"Oh he definitely listens to feedback. Every single time.","Does your manager take input well?","Quality","flouting"
"Great, I love when my calendar is just one long blue rectangle.","You have five back-to-back meetings today.","Quality","flouting"
"Classic. Nothing I love more than discovering a critical bug in prod on a Friday.","We found an issue in prod.","Quality","flouting"
"She's basically a people person. Real gift for collaboration.","How does she handle conflict?","Quality","flouting"
"Oh the sprint planning was a blast. Really efficient use of three hours.","How was sprint planning?","Quality","flouting"
"Yeah, the documentation is incredibly thorough. All twelve words of it.","Is there documentation for this system?","Quality","flouting"
