"utterance","context","maxim","violation_type"
"Ask me again after the announcement.","Is the company being acquired?","Quantity","opting_out"
"That's confidential.","What were the terms of the settlement?","Quantity","opting_out"
"I've been asked not to discuss it.","What came out of the investigation?","Quantity","opting_out"
"You'll find out when everyone else does.","Did you know about the layoffs?","Quantity","opting_out"
"I'd rather keep that private.","How much equity do you have?","Quantity","opting_out"
"I don't think it's my place to say.","Why did Marcus really get fired?","Quantity","opting_out"
"Off the record or on?","What do you actually think of the new CEO?","Quantity","opting_out"
"That's between me and the review committee.","What was in your performance evaluation?","Quantity","opting_out"
"I really can't get into that right now.","What happened between you and the client?","Quantity","opting_out"
"Let's just say it's complicated and leave it there.","What's the status of your relationship with that vendor?","Quantity","opting_out"
"Not something I'm at liberty to confirm or deny.","Were you involved in the decision to freeze hiring?","Quantity","opting_out"
"I'll let the official statement speak for itself.","What's your personal take on what happened?","Quantity","opting_out"
"You should really get that from the source.","What did they say they're going to do about it?","Quantity","opting_out"
"I'd prefer not to weigh in on that.","Who do you think was in the wrong?","Quantity","opting_out"
"That's not mine to share.","What did he say in his resignation letter?","Quantity","opting_out"
"This isn't the right venue for that conversation.","Can you just tell me what's actually going on with the project?","Quantity","opting_out"
"I'll plead the fifth on that one.","Did you vote to remove him from the committee?","Quantity","opting_out"
"Some things are better left unsaid.","What did you really think of her proposal?","Quantity","opting_out"
"I'm going to stay in my lane on this one.","What's your take on the product direction?","Quantity","opting_out"
"That one's above my clearance level.","What's in the internal audit?","Quantity","opting_out"
"Ask HR.","What's the reason he was let go?","Quantity","opting_out"
"I've said everything I'm going to say about it.","Can you give us more detail on the incident?","Quantity","opting_out"
"I think we should let legal handle the messaging on that.","What exactly went wrong?","Quantity","opting_out"
"That's not something I want to put in writing.","Can you document what was agreed in the meeting?","Quantity","opting_out"
"I'd rather not revisit it.","Can you walk me through what you said in the meeting?","Quantity","opting_out"
"We decided to postpone the release until after the holiday freeze.","Why didn't v2.4 go out last week?","Cooperative","none"
"The server was down for about 90 seconds during the failover.","Did anyone notice the outage?","Cooperative","none"
"I'll need access to the staging environment and a copy of the latest schema.","What do you need to get started?","Cooperative","none"
"She's on track to finish by Thursday, assuming no new blockers.","Will the designer make the deadline?","Cooperative","none"
"The issue was a race condition in the queue consumer — I've pushed a fix.","What happened with the duplicate messages?","Cooperative","none"
"We're using the same vendor but renegotiated the rate down by 15%.","Did we switch providers?","Cooperative","none"
"The API change is backward-compatible so existing integrations won't break.","Will this affect any of our partners?","Cooperative","none"
"I paired with her on it yesterday and she's got a good handle on the approach.","Does she need help with the refactor?","Cooperative","none"
"It's blocked on the legal review — I've pinged them twice this week.","Why is the partnership agreement stalled?","Cooperative","none"
"The error rate dropped from 2.3% to 0.4% after the deploy.","Did the fix work?","Cooperative","none"
"We ran a/b testing for two weeks with about 8,000 users per variant.","How did you validate the change?","Cooperative","none"
"The budget covers three contractors through Q2 but not beyond.","Can we extend the contract team?","Cooperative","none"
"I've already updated the runbook and notified the on-call rotation.","Is anyone prepared for this?","Cooperative","none"
"It's React 18 with server components — we migrated from Next.js pages router.","What's the frontend stack?","Cooperative","none"
"The candidate has eight years of backend experience, mostly in Go and Python.","Is she qualified?","Cooperative","none"
"We cut the feature set by about a third to hit the date.","How did you make the deadline?","Cooperative","none"
"The dashboard loads in under two seconds now, down from twelve.","Is it faster after the optimization?","Cooperative","none"
"Both options are viable but option A saves us about six weeks of work.","Which approach do you recommend?","Cooperative","none"
"I've documented the decision and the reasoning in the ADR.","Is there a record of why we chose this?","Cooperative","none"
"The team voted 7-2 to keep the current process with minor adjustments.","What was the outcome of the retro?","Cooperative","none"
"He's a real team player. You can tell by how often he cc's the entire company.","Is he collaborative?","Quality","flouting"
"The deadline is aggressive. In the same way that a volcano is warm.","Is the timeline realistic?","Quality","flouting"
"The code is self-documenting. In the sense that reading it is an act of faith.","Is the codebase maintainable?","Quality","flouting"
"She brings a lot of energy to the meetings. Mostly anxiety.","How is she in meetings?","Quality","flouting"
"The process is streamlined. Down to only seventeen approval steps.","Is the workflow efficient?","Quality","flouting"
"He's very thorough with code review. Last one took him three sprints.","Is he a good reviewer?","Quality","flouting"
"The rollout was controlled. In that we watched helplessly as it rolled out.","Was the release managed well?","Quality","flouting"
"The team morale is high. They've stopped complaining, which is basically the same thing.","How's the team feeling?","Quality","flouting"
"The meeting was productive. We scheduled three follow-up meetings to discuss what we discussed.","Did you make progress?","Quality","flouting"
"The onboarding is well-structured. By day four you'll know where the bathroom is.","How's the onboarding?","Quality","flouting"
"The system is robust. It's been up for almost two whole days this time.","Is the platform stable?","Quality","flouting"
"The client feedback was constructive. They used the word disappointed only once.","What did the client say?","Quality","flouting"
"His estimates are reliable. He said two weeks and it only took two months.","Can we trust his timelines?","Quality","flouting"
"The test coverage is solid. If you don't count the parts that aren't tested.","Are we well-tested?","Quality","flouting"
"She's great at prioritization. Everything is P0.","Does she manage the backlog well?","Quality","flouting"
"I wonder if the vending machine has been restocked.","Can we finalize the pricing model today?","Relation","unknown"
"There's a really good documentary about octopuses.","What's our plan for handling the data breach?","Relation","unknown"
"Have you ever been to a drive-in movie?","The board wants a response by end of week.","Relation","unknown"
"My neighbor just got chickens.","How are we going to handle the service degradation?","Relation","unknown"
"I keep thinking about that hiking trail we saw.","Did the stakeholders approve the revised scope?","Relation","unknown"
"Apparently there's a meteor shower tonight.","We need to assign owners to the remaining tickets.","Relation","unknown"
"The cafeteria changed their soup rotation.","What's our go-to-market timeline?","Relation","unknown"
"I just learned that honey never expires.","Can you walk me through the incident post-mortem?","Relation","unknown"
"Someone left their umbrella in the conference room.","Are we going to address the performance regression?","Relation","unknown"
"Have you seen the new mural on the second floor?","What's the status of the compliance remediation?","Relation","unknown"
"My flight got upgraded last time I flew through Denver.","We need to decide on the database migration strategy.","Relation","unknown"
"I think I left my charger at home.","The audit findings need to be addressed by Friday.","Relation","unknown"
"There's a farmers market on Saturdays now.","Did you review the security scan results?","Relation","unknown"
"Do you know a good place to get shoes resoled?","What are we doing about the customer churn numbers?","Relation","unknown"
"I was reading about how they make sourdough starters.","Can we discuss the service level agreement?","Relation","unknown"
"Used to hook up with a girl who got off calling me ""Daddy"" during our normal sexy time. I was cool with it.  One night we got extra drunk and as i'm hitting it from the back she says "" dad please go slower, please love me""...I stopped and was like.....WHAT?","A drunk girl in college told me I reminded her of her dad. (Which was a bit of a turn off)  Then a completely separate time she tried to hook up with me, I said ""I thought I reminded you of your dad"" with the response of ""exactly""  Yeah that one I'm not to proud of....","Manner","flouting"
"I swear reading that made me feel pain in my dick although I don't even have one....","I was fucking a girl from behind while she was rubbing her clit I slipped out and the hole of my dick caught on one of her nails and ripped it. Started leaking blood from my dick, went to the er and had to have a dr look at my bloody dick and he basically said yea it's going to suck for awhile and you're going to pee blood and it will hurt like hell but it will heal on its own."" Basically paid a dr to look at my bloody dick and get told ""that sucks good luck","Quality","flouting"
"I've had something similar but from the opposite side. I bled and it hurt. I feel your pain!","I was fucking a girl from behind while she was rubbing her clit I slipped out and the hole of my dick caught on one of her nails and ripped it. Started leaking blood from my dick, went to the er and had to have a dr look at my bloody dick and he basically said yea it's going to suck for awhile and you're going to pee blood and it will hurt like hell but it will heal on its own."" Basically paid a dr to look at my bloody dick and get told ""that sucks good luck","Manner","flouting"
"My worst nightmare","Was mega horny and talking to a girl who was also mega horny. She lived an hr+ away and on a workday I went over for a late night booty call. She got off. I didn't. I got 1 hr of sleep before driving home to get ready for work.  2 weeks later I started developing the first genital warts.   Singlehandedly destroyed my sex life for years, without even having an orgasm. FML.","Quality","flouting"
"60 dollar red velvet cheese cake milkshake""  Sounds like a sex act","I partook in water sports with a rich girl because she offered me a 60 dollar red velvet cheese cake milkshake","Manner","flouting"
"Truly modern poetry","I partook in water sports with a rich girl because she offered me a 60 dollar red velvet cheese cake milkshake","Quality","flouting"
"How the fuck is a milkshake 60 dollars","I partook in water sports with a rich girl because she offered me a 60 dollar red velvet cheese cake milkshake","Relation","flouting"
"I hate you.   (Dms are open)","In the MSN chat group one woman and I did NOT get along. At a few meet ups we would argue about the dumbest thing.  Someone suggested we either fight or fuck but just shut up.  I learned what a hatefuck was.   And went back several times, cause man she was a piece of work. And killer in bed.","Manner","flouting"
"I've always wondered what it's like post-nut to do that.  Like...do you just immediately leave the room or....","In the MSN chat group one woman and I did NOT get along. At a few meet ups we would argue about the dumbest thing.  Someone suggested we either fight or fuck but just shut up.  I learned what a hatefuck was.   And went back several times, cause man she was a piece of work. And killer in bed.","Quantity","flouting"
"In Japanese, a girl who lies there like a piece of fish is literally called a maguro, a piece of tuna sashimi.","The sex was so bad with one woman, I felt the need to go back again to see if it was in fact me. I was a at a low point in my self esteem to begin with, which led to the first encounter. She laid there like a slug. I felt I had done something wrong. But I went back, and discovered that it wasn't in fact me, she was just terrible at sex.","Relation","flouting"
"Pretty sure that is now a crime here (Australia)","Sending pictures to a person only for that person to post said puctures in the group chat","Quality","violating"
"SHUT UP IM GETTING VIRTUAL ASS GENTS","Was sexting my high school girlfriend and we started to send pics. I was getting spammed in the boys group chat at the same time... Guess where some of my pics ended up being sent?","Manner","flouting"
"Get any dic pics back","Was sexting my high school girlfriend and we started to send pics. I was getting spammed in the boys group chat at the same time... Guess where some of my pics ended up being sent?","Quantity","flouting"
"The cops did WHAT and broke it up???","With a person on a bench by the river one night. Cops came and broke it up. They should have just shot me","Quantity","flouting"
"You have to go in through the bottom hole, not the top","First time I tickled my prostate (or tried to anyway) I threw up.","Manner","flouting"
"With your mouth, right?","A girl wanted to eat my ass but no matter how good it felt I couldn't stop myself from making a noise that was like stifling laughter","Manner","flouting"
"I woke up to a dude blowing me once and i chased him out of the house past everyone who found out about it. Did feel good when I woke up but incredibly fucked up when I realized what was happening.","I woke up to my best friend's brother performing oral sex on me. I'm a guy.   I could and probably should have lost my mind and flipped out, but it felt incredibly good so I pretended I was still asleep and let him finish.   I was young. It was only when I got older that I realised how fucked up he was for doing that, but by then, he was no longer around.   Aside from you guys,  nobody will ever know.","Quality","flouting"
"The cylinder guy?","Your trying to summon that one guy again arnt you","Manner","flouting"
"Love it!  We visited the Field Museum last summer.  Took us a while to figure out that the north parking lot is actually south of the museum.","Large paleo storage three or so secure floors below the Field Museum in Chicago. Absolutely incredible to see all those specimens at such varying stages of being studied.   I even got to touch Sue's (the t rex) last meal.   Wild.","Relation","flouting"
"Looks like the sniper who was waiting on him to reveal this info finally got him. That's a shame.","When I was 14 I found a staff pass to a festival.  When asked how I had it I said my dad John works for them.   I knew no John but it was a name I knew a lot of people had.  I got to sit next to blink 182 at lunch etc.   It was great n","Quality","flouting"
"I had a production pass to Coachella. Even with  production pass I couldn't get a good view of the Childish Gambino. So I went on stage. On my adventure to find the stage people would stop and ask me questions. I said I was, Amanda's runner"" and they'd let me through. I made up Amanda. It worked.","When I was 14 I found a staff pass to a festival.  When asked how I had it I said my dad John works for them.   I knew no John but it was a name I knew a lot of people had.  I got to sit next to blink 182 at lunch etc.   It was great n","Relation","flouting"
"A sick man entered the house of lords and left a lady!","I have technically sat in the House of Lords- because I was unwell when I was visiting there, and so was granted an exception to the usually strict rules about not sitting on the seats there… I'm pretty sure that makes me a Lady now","Manner","flouting"
"I was an engineer for a hydro firm out of university and went into many spiral cases that have been dewatered. It is an experience. I would use portable laser tracker metrology tools to measure case walls for modernization improvements based on model tests. Interesting work. Glad to see someone else on reddit who has gotten to see this!","When I was 15 I went to my uncles workplace. He worked at one of the largest hydroelectric powerplants here in Sweden.  At that time they where doing some upgrades and maintenance at one of the turbines so it was closed off and parts of it was removed so we could go inside of it.  So I was inside of the part where all the water goes and spins the turbines, that was pretty cool too see","Quantity","flouting"
"The Cray-2 was liquid cooled, weighed about 2,500 kg, drew 150-200 kW, and processed instructions at 1.9 GFlops. For mid 80's it was a beast. Modern smartphones (and GPUs) are hundreds to thousands of times faster.  Every now and then I marvel at how technology has progressed.","Super computer at Wright-Patterson Air Force Base.  I'm old enough to remember Cray super computers, and these computers made a Cray seem like an old Pontiac car next to a Bugatti.","Quantity","flouting"
"That brought back a forgotten memory. As a child on the ""It's a Small World"" ride, tge ride stalled out and a cast member came and got us down into a tunnel then back up an out at a random spot in the background.","The tunnels under the Magic Kingdom in Disney World. Its like a whole city that cast members use to move from the outside world or one land to another land without hurting the magic for the guests.","Relation","flouting"
"RadioACTIVE man, stupid!","submarines. I served on four of them. Radioman.","Manner","flouting"
"I was just about to post my own answer to the prompt with this same thing.   I was a diver at the NBL. I would say that inside the pool itself and behind any doors that required extra clearance on my NASA badge made me feel like I was seeing something behind the curtain.   Particularly, I had access to certain rooms of the mission control building and certain facilities where the NASA EMU suits were tinkered with. Those visits made me feel like I had special access to something.","NASA Mission Control and the Neutral Buoyancy Lab (pool) where they train.","Quantity","flouting"
"In 2015 we went to the museum there from Australia, we had my 18 year old sister in law with us and I couldn't get over that she being younger then myself and her sister by 10 years knew of the event but was too young at the time to remember it and didnt really know much about it.   I still remember the heavy feeling of walking around that place I couldn't Imagine working there.","I'm sitting two stories underneath the World Trade Center as I type this. I'm a security guard here. It's a pretty cool facility underground.","Quantity","flouting"
"I have been in the back room of the Smithsonian Natural History Museum. Seeing them open a drawer of bird skins with the label ""Collected by Teddy Roosevelt"" and then they opened the next drawer and it says ""Collected by Charles Darwin.""   Went on a spirit jars tour of the London Natural History Museum and they had a colossal squid. Then they opened a cabinet that was full of Darwin stuff including jars that contained the holotypes for various species. Super cool.","I've been in the collections of many of the great natural history museums, like the Smithsonian and London museum. Seeing all of the specimens that aren't on display and are just lying around in various states of preparation and study is always pretty cool.","Quantity","flouting"
"How rustic is it? It's hard to find photos so I've wondered what is like. Presidents don't seem to use it much anymore.","Camp David","Quantity","flouting"
"Did you play chess with Joshua.","NORAD room with all of the monitors.","Relation","flouting"
"My next door neighbor, Mr. Ranken, and his father, were the ones who put that pool in. He gave my little brother some left over tile pieces for a report he wrote in school. Neat, huh?","Swimming in the outdoor Neptune Pool at Hearst Castle. No real shallow end.","Relation","flouting"
"Protipnive seen but never experienced: fishnet base layer. it sounds ridiculous, but once you add layers in top it basically allows larger air pockets next to the skin. and air is the best insulation.","depends what branch but some of the cold weather gear is actually pretty solid, especially the layers system they use now. my dad was army and swears by those fleece jackets even years later - still wears his around house all the time and it holds up way better than civilian stuff i've bought","Relation","flouting"
"Came here to say this.  If you use it properly (I.e. layering) it's really good. You can get civilian stuff that is lighter but it's not nearly as durable.  I have one of the sleep systems and it's phenomenal because I don't go back packing.","depends what branch but some of the cold weather gear is actually pretty solid, especially the layers system they use now. my dad was army and swears by those fleece jackets even years later - still wears his around house all the time and it holds up way better than civilian stuff i've bought","Quantity","flouting"
"Yeah it's pretty crazy to eat a somewhat edible pepperoni pizza that's been sitting in a crate for a few years.","Food preservation. MREs are wild.","Quality","flouting"
"Norwegians have low round ones with the heater in the centre.  Toasty.","Not a veteran, but a vet taught me about this.  Canvas tents. So much better than even the best of the cheap crap polyester ones. Rain proof, snow proof. Insulates way better against heat and cold if set up properly. Most of then have ports for stoves for cooking/heating  The only real problems are that they're expensive, usually only come in 3+ person sizes, though i've seen smaller. And maintaining the canvas can be a pain in the ass sometimes.","Relation","flouting"
"&gt;The only real problems are that they're expensive, usually only come in 3+ person sizes, though i've seen smaller.   The bulk and weight are huge drawbacks if you're hiking.","Not a veteran, but a vet taught me about this.  Canvas tents. So much better than even the best of the cheap crap polyester ones. Rain proof, snow proof. Insulates way better against heat and cold if set up properly. Most of then have ports for stoves for cooking/heating  The only real problems are that they're expensive, usually only come in 3+ person sizes, though i've seen smaller. And maintaining the canvas can be a pain in the ass sometimes.","Quantity","flouting"
"I still have a goretex jacket from 20+ years ago and just wore it a couple weeks ago.","Polypropylene/cold weather/artic gear.   Anything Goretex.   3 piece sleeping bag. If you stripped down to your skivs and zipped it up, and put a pad on the ground, you'd stay toasty in freezing temps. Only downside was it's small as hell, hard to get dressed inside it without opening.   I still have 2 Goretex jackets and liners that are over 20 years old.   ODG duffel bags.  Metal AR mags- beat to shit, lived through every war theater on the planet and kept on truckin.  Lots of stuff.","Quantity","flouting"
"Idk what that means but now I'm curious!  What is DD-214???","The DD-214","Quantity","flouting"
"True source of American freedom","The DD-214","Quality","flouting"
"I'm long retired and my three poncho liners ""woobie"" are STILL some of my most precious possessions.","The only item worth the money is the ""woobie"".   IYKYK","Cooperative","none"
"And the smokers jacket. Same material as the woobie. This thing blocks wind like magic but somehow never lets you get to hot.","The only item worth the money is the ""woobie"".   IYKYK","Quantity","flouting"
"My dad was in the army and the woobie is by far the greatest blanket ever made. I keep meaning to buy my own","The only item worth the money is the ""woobie"".   IYKYK","Quality","flouting"
"Write in the rain.  Waterproof paper, still took ink like a champ.    Rain was never where the water came from, you'd soak it in sweat to the point of saturation.","The green ""memo"" notepads in every imaginable size. Loved those things!","Manner","flouting"
"I moved house last year and found so many of those lying around in weird places, most of them only a few pages used","The green ""memo"" notepads in every imaginable size. Loved those things!","Relation","flouting"
"I still have one and my husband retired 14 years ago. Still writes perfectly smooth.","Skillcraft pen","Quality","none"
"Honestly given the price difference, the consumer-grade javelin does just fine","The 240B, and the Charlie and the Gulf and the Lima. The Javelin.  The later M2 Bradley variants.  FBCB2 and BFT. The newer laser sights and the ENVG-B.  MBITRs etc. have been a massive improvement.","Manner","flouting"
"My nana missed that train. She went on to live until her 90s.","I was about to go into London on my day off, but something told me not to take the train.  This was back in 1991 - an IRA bomb went off in Victoria Station that morning","Relation","flouting"
"Ha, fuck, you're probably right.","The job search is the gap year lol I applied for 6 months before landing something which I will start in July","Cooperative","none"
"Just curious, why is your start date so far away?","The job search is the gap year lol I applied for 6 months before landing something which I will start in July","Cooperative","none"
