"utterance","context","maxim","violation_type"
"Most of religion is performative.","You handled it perfectly. You then can respond Matthew 6:6, ""But when you pray, go into your room, close the door and pray to your Father, who is unseen. Then your Father, who sees what is done in secret, will reward you"".  No offense but their actions sound performative.","Cooperative","none"
"I'm guessing that they are Baptists.🤷‍♀️","You handled it perfectly. You then can respond Matthew 6:6, ""But when you pray, go into your room, close the door and pray to your Father, who is unseen. Then your Father, who sees what is done in secret, will reward you"".  No offense but their actions sound performative.","Cooperative","none"
"It will only be a matter of time before they start doing things without OP, if they're not doing so already.","NTA, but maybe find new friends. They won't stop pushing the issue and will only get louder about how they feel offended.","Cooperative","none"
"This.","NTA. But these people are not your friends. Friends accept your religious preferences and don't try to force you into things you very clearly told them you don't like to do.","Quantity","flouting"
"I have been to several AA meetings and people hugged at the end. I'm not a hugger, especially because i have big boobs!  I just put my hands up and shake my head no. If people want to judge me, that's a them problem.","Proselytizing is a big part of some religions. They've got you in their sights, either very intentionally or subconsciously working on converting you. If they genuinely believe in their religion, then they think they're doing you a favor by working on altering your behavior and belief system. They believe you're doomed to burn in hell eternally if you don't,  ya know?","Quantity","flouting"
"This! I was legit just in my local fruit and vegetable market and had some woman start to tell me all about the “new system” I’m like “I’m Catholic. I know that “New System” crap is JW. Not interested.” She looked like she’d swallowed a lemon and called me evil and walked off. 🤣","NTA and so damn typical for religious whack jobs like this to force their beliefs onto others but then act like righteous victims of oppression when asked to calm down.","Quantity","flouting"
"I am a Christian and you are correct! We are to set examples &amp; speak of God, not judge.","You handled it correctly. If they are your friends they should accept you as you are. Religious people are supposed to accept people as they are right? Mention that and see what they say.","Cooperative","none"
"Someone also had better have offered to prorate *the shit* out of OP’s last month of rent.","NTA, you had already agreed to move out earlier than you wanted, and then they demanded even more from you.   You pay rent, you have a right to be there until you move out.   They knew your timeline and it's on them for not planning for it.","Quality","flouting"
"They can't stick to the plan and just assumed OP will accommodate them. It's frankly insulting that they didn't consult with her and just told her that the new girl is coming. They were hoping OP will move out sooner by trying to force her out.  OP you're not selfish. They only brought the inconvenience upon themselves.","NTA, you had already agreed to move out earlier than you wanted, and then they demanded even more from you.   You pay rent, you have a right to be there until you move out.   They knew your timeline and it's on them for not planning for it.","Cooperative","none"
"Literally, you are already doing them a favor by moving out ahead of time, then they try and pull a fast one on you, and your expected to just do what they say, what cause “we are supposed to look out for each other”. She thinks that she’s inconvenienced? How is that your problem when you stuck to what you said you would do. They need to quit their bitching and moaning and stop blaming you.","NTA, you had already agreed to move out earlier than you wanted, and then they demanded even more from you.   You pay rent, you have a right to be there until you move out.   They knew your timeline and it's on them for not planning for it.","Cooperative","none"
"exactly and how are they looking out for you OP???","We all have to look out for each other""  yet you weren't consulted about ANY of these changes. You were expected to be willfully inconvenienced while they went on their merry way. You did the right thing. She can continue sleeping on the couch","Quantity","flouting"
"Or lying that she liaised with the landlord. Trying to move her bestie in for free.","Absolutely NTA  You already made a big accommodation by changing your move out date to the new date they requested. The *audacity* to suddenly ask you to move out two weeks earlier and sleep on the couch!   Why is Erica so invested in this? Something tells me she’s making a cut somewhere.","Cooperative","none"
"Thank you for calling this out I thought I was going mad for wondering why, in April, the friend was coming down in June being an issue already","[You have GOT to be kidding me - you posted this TWO YEARS ago and are still harping on it?](https://www.reddit.com/r/AmItheAsshole/comments/1959agr/aita_for_not_moving_out_of_my_room_early_for_the/)","Cooperative","none"
"This is the answer","[You have GOT to be kidding me - you posted this TWO YEARS ago and are still harping on it?](https://www.reddit.com/r/AmItheAsshole/comments/1959agr/aita_for_not_moving_out_of_my_room_early_for_the/)","Quantity","flouting"
"It's even the same person and not a bot reposting it!","[You have GOT to be kidding me - you posted this TWO YEARS ago and are still harping on it?](https://www.reddit.com/r/AmItheAsshole/comments/1959agr/aita_for_not_moving_out_of_my_room_early_for_the/)","Cooperative","none"
"Exactly!! I don't get the issue. She's out now and everything is past history.","It's April....? Did this happen last year, and if so why are you still dwelling on it?","Cooperative","none"
"Op literally posted this two years ago and is still mad.","NTA. You inconvenienced the new girl? How about them inconveniencing you by wanting you to move out earlier? I'm assuming you already paid your rent for where you were. I didn't hear anyone wanting to reimburse you for that. And I figure theres a good reason why you chose to move out and live somewhere else. Don't sweat it, keep your room  until moving day.","Cooperative","none"
"This. The audacity of him making you feel bad when he totally ignored you in making decisions. Then assumed you're going to pay for everything.   Just plan your own trip. You deserve to enjoy it without all this baggage.","Save the Disney cards that your mother gave you, tell him you don't want to go with a group and let him go by himself. Perhaps that way he won't plan another trip without consulting you on it. Doesn't sound like he has much respect for you at all.","Cooperative","none"
"OP is NTA   Totally agree - OP should let her boyfriend go, without her Disney gift cards, with his ""group"",  and plan her own trip to Disney another time.   BF may or may not be invited.","Save the Disney cards that your mother gave you, tell him you don't want to go with a group and let him go by himself. Perhaps that way he won't plan another trip without consulting you on it. Doesn't sound like he has much respect for you at all.","Cooperative","none"
"Also hide the Disney cards so he can't take them with him.","Save the Disney cards that your mother gave you, tell him you don't want to go with a group and let him go by himself. Perhaps that way he won't plan another trip without consulting you on it. Doesn't sound like he has much respect for you at all.","Cooperative","none"
"Lock the cards up","Save the Disney cards that your mother gave you, tell him you don't want to go with a group and let him go by himself. Perhaps that way he won't plan another trip without consulting you on it. Doesn't sound like he has much respect for you at all.","Cooperative","none"
"And when he comes back, make him jump up and down before coming in the door - to shake off the roaches.","Save the Disney cards that your mother gave you, tell him you don't want to go with a group and let him go by himself. Perhaps that way he won't plan another trip without consulting you on it. Doesn't sound like he has much respect for you at all.","Quality","flouting"
"Nah you’re right , you’re all right.","Why on this earth would you allow someone else to decide how you spend a gift your mother got for YOU to celebrate YOUR achievement? NTA but come on.","Cooperative","none"
"Your BF is an entitled AH. Everyone is telling you this. Cancel and go with your mom or someone who isn’t going to make this trip a stressful disaster.","It’s funny cause he was actually begging me to pay half he was mad that I said no…reiterated that he wants me to clarify the reason I’m saying “no” is because I didn’t agree to this trip…the more I think about it the more I have the ick and all the resentment everyone is speaking on.","Cooperative","none"
"It sounds like he wanted to join in on a trip that was already in the planning and thought “oh cool, and we can use OP’s gift cards!” Who are the others in the group? Are they friends of yours, or mainly his?","It’s funny cause he was actually begging me to pay half he was mad that I said no…reiterated that he wants me to clarify the reason I’m saying “no” is because I didn’t agree to this trip…the more I think about it the more I have the ick and all the resentment everyone is speaking on.","Cooperative","none"
"You have a boyfriend who either doesn't listen to you or doesn't care what you do and don't want. Think carefully about continuing this relationship. Have you heard the Maya Angelou quote ""when people show you who they are, believe them the first time?"" He is showing you who he is.","It’s funny cause he was actually begging me to pay half he was mad that I said no…reiterated that he wants me to clarify the reason I’m saying “no” is because I didn’t agree to this trip…the more I think about it the more I have the ick and all the resentment everyone is speaking on.","Cooperative","none"
"Honestly, you’re rigght! I’m very butthurt. I’m a planner and I love to plan things so that things run smoothly and were comfortable. I like to to know things are covered and we don’t have to stress about anything in between. He’s making decisions that I would never agree with and then getting butt hurt that I’m not agreeing very frustrating.","NTA. You should consider this relationship and whether he cares about your feelings and opinions, not to mention comfort, even about what you own,cwhat is yours. He is railroading this down your throat and doesn't seem to care about it except when you fail to comply. Think about it.","Cooperative","none"
"...with him.","Don't go.","Manner","flouting"
"People like doing what they like"" is a great take","Because having to go to work feels bad, and getting up early to do whatever you'd like with your day feels great!","Cooperative","none"
"Definitely. I have stress dreams on weeknights.","Go to sleep stressing about work the next day = poor quality sleep.   Go to sleep knowing tomorrow is a day off = better quality sleep  7.5 hours of good quality sleep + waking up without needing to rush around to get ready for a work day will make you feel much better than 8 hours of lower quality sleep + waking up to a busy morning.","Cooperative","none"
"So basically I should gaslight myself to believe I have the day off the next day everyday","Go to sleep stressing about work the next day = poor quality sleep.   Go to sleep knowing tomorrow is a day off = better quality sleep  7.5 hours of good quality sleep + waking up without needing to rush around to get ready for a work day will make you feel much better than 8 hours of lower quality sleep + waking up to a busy morning.","Quality","flouting"
"I’d love to but I’d go to jail If I didn’t show up","Find work you will actually enjoy. That solves your problem","Quality","flouting"
"Yeah there's a little piece of strategicly placed velcro. Not sure where exactly. I tried the same thing with a full face respirator and it kinda worked.","Don't they have a little scratch pad in their helmet to scratch the nose?","Cooperative","none"
"The only trouble is putting it back in","you can take your arm out the space suit sleeve and itch yourself if the suit is big enough","Quantity","flouting"
"How about a wedgie?","Think of a space suit as less of a clingy garment, and more of a little personal spaceship. You can easily slide your arm out of your sleeve and reach up into your helmet to scratch.","Relation","flouting"
"Have you seen astronauts on EVA before? They can barely bend their arms, let alone snake them up the suit and into their helmet.","Think of a space suit as less of a clingy garment, and more of a little personal spaceship. You can easily slide your arm out of your sleeve and reach up into your helmet to scratch.","Quality","violating"
"Yes... Into the helmet...","Think of a space suit as less of a clingy garment, and more of a little personal spaceship. You can easily slide your arm out of your sleeve and reach up into your helmet to scratch.","Manner","flouting"
"Weirdly aggressive","They ignore it until the job is done instead of being a little bitch.","Cooperative","none"
"Yeah, I'm a big strong boy and I never fucking itch. If those scientists and pilots and surgeons leaving the safety of our planet in a glorified tin can to advance our understanding of the universe feel like they need a scratch, they're fucking pussies.","They ignore it until the job is done instead of being a little bitch.","Quality","flouting"
"Yeah I'd assume that astronauts are somewhat more disciplined than the general public, with much better impulse control.   It's just an itch, it will pass. No biggie.","They ignore it until the job is done instead of being a little bitch.","Cooperative","none"
"Fluid in your tissues is more evenly distributed in microgravity. On Earth it tends to collect in your lower body especially if you have health issues or don't move around enough.  edit: Just adding on here, not trying to be contrarian.","heard without gravity, all the blood doesn't flow to their bottom half of the body but mostly to their head. some even have their heart smaller after 7 days in the space.","Cooperative","none"
"They still have a beating heart that pumps blood around. On Earth your heart will pump it around your entire body, not just the bottom half if that's what you're implying.","heard without gravity, all the blood doesn't flow to their bottom half of the body but mostly to their head. some even have their heart smaller after 7 days in the space.","Quality","violating"
"Aha! So if I have tons of incriminating evidence in my computer, I can delete it and then download my entire Steam collection (more gigs than my computer has) and they wouldn't be able to recover the evidence?    Edit: the consensus seems to be, kinda, maybe, but definitely NOT yes  I will therefore refrain from law breaking","the memory space gets assigned as 'available'. The program still exists until it has been rewritten in memory space. That is why the police can recreate stuff deleted.","Quality","flouting"
"that’s why you should zero-out your drives when disposing of them.","the memory space gets assigned as 'available'. The program still exists until it has been rewritten in memory space. That is why the police can recreate stuff deleted.","Cooperative","none"
"This is the true ELI5 answer. The data isn't really deleted, the marker that points to the data is erased so your computer no longer knows how to find it.","Imagine owning a massive warehouse where you have a book telling you everything in it. In general when you decide you don’t want something you erase it out of the book, but leave it on the shelf as doing something with it costs energy and time.  So when you get something new you look in the book, find a blank location, go there, and replace what is on the shelf with the new item and then dispose of the old one.","Cooperative","none"
"&gt;Don’t discount natural talent.  But don't overvalue it, either. A lot of times ""natural talent"" really means ""is more willing to spend hours in practice/study than their peers"".","Obsession, supportive parents, natural talent. Don’t discount natural talent. We don’t understand the human brain. Some people are naturally very good at certain things.   Would they still be good at it if they weren’t exposed to it at a young age? Maybe not, but they’d probably be very good at something else.","Cooperative","none"
"Don't discount abusive parents forcing their children to do something either.","Obsession, supportive parents, natural talent. Don’t discount natural talent. We don’t understand the human brain. Some people are naturally very good at certain things.   Would they still be good at it if they weren’t exposed to it at a young age? Maybe not, but they’d probably be very good at something else.","Cooperative","none"
"Yep. I was a foster kid and it irks my nerves hearing about Simone Biles talent. If she stayed in foster care she wouldn't have talent because prodigies require insane parents who are already rich. How many foster kid have natural talent that will never get seen or nutured? Poor kids? None","Obsession, supportive parents, natural talent. Don’t discount natural talent. We don’t understand the human brain. Some people are naturally very good at certain things.   Would they still be good at it if they weren’t exposed to it at a young age? Maybe not, but they’d probably be very good at something else.","Cooperative","none"
"Ime it’s not always wealth so much as dedication. Parents giving of their own time to make the child’s dream a reality. This is what parenting is by definition to some, but to many it is not.","They have a natural aptitude for a particular skill, the interest in pursuing training to cultivate that skill, and parents wealthy enough to help them access that training.","Cooperative","none"
"Thomas Edison also hired thugs to beat the crap out of his competitors.","Thomas Edison said that ""Genius is 1% inspiration and 99% perspiration","Relation","flouting"
"Inborn talent was what made Judit a legend in comparison to the others","A great example that maybe undermines the belief that all prodigious talent is inborn would be the Polgar sisters in chess.","Quality","violating"
"Ask your doctor if Valxyloprozxin is right for you.","The “generic” name is the actual name (or sometimes a shortened version) of the chemical compound that makes up the medication.   The brand name is a marketing name invented by the pharmaceutical company that patented it that’s easier to say/remember.","Manner","flouting"
"Adding to this: the generic name is actually semi-formulaic. It will tell you the general type of medication, the target of the medication, and what’s its use is.","The “generic” name is the actual name (or sometimes a shortened version) of the chemical compound that makes up the medication.   The brand name is a marketing name invented by the pharmaceutical company that patented it that’s easier to say/remember.","Cooperative","none"
"Those are made up too though, although they do try to follow a few rules.","The “generic” name is the actual name (or sometimes a shortened version) of the chemical compound that makes up the medication.   The brand name is a marketing name invented by the pharmaceutical company that patented it that’s easier to say/remember.","Cooperative","none"
"The pharmaceutical company coins a unique name and applies for a trademark for their patented drug. Source: I was a juror in a trademark infringement case where Pfizer was the defendant.","The “generic” name is the actual name (or sometimes a shortened version) of the chemical compound that makes up the medication.   The brand name is a marketing name invented by the pharmaceutical company that patented it that’s easier to say/remember.","Cooperative","none"
"Ask your doctor is Diaceytlmorphine is right for you.  Remember, always insist on Heroin from Bayer, they're the Heroin people...","The “generic” name is the actual name (or sometimes a shortened version) of the chemical compound that makes up the medication.   The brand name is a marketing name invented by the pharmaceutical company that patented it that’s easier to say/remember.","Quality","flouting"
"Completely incorrect. The chemical name is a different name entirely, and described the chemical matter.   The generic name is decided by usan and the inn in the who with some input from the pharma company. But they follow conventions for classes of drugs.   https://www.goodrx.com/drugs/medication-basics/how-are-drugs-named","The “generic” name is the actual name (or sometimes a shortened version) of the chemical compound that makes up the medication.   The brand name is a marketing name invented by the pharmaceutical company that patented it that’s easier to say/remember.","Cooperative","none"
"mostly yeah, but then there are some cases where the chemical compound itself has two names (for example acetaminophen/paracetamol)…","The “generic” name is the actual name (or sometimes a shortened version) of the chemical compound that makes up the medication.   The brand name is a marketing name invented by the pharmaceutical company that patented it that’s easier to say/remember.","Cooperative","none"
"The internal names can be super silly, I worked for an instrument manufacturer and we had a product that *link*ed two instruments together... internal codename was Zelda","The “generic” name is the actual name (or sometimes a shortened version) of the chemical compound that makes up the medication.   The brand name is a marketing name invented by the pharmaceutical company that patented it that’s easier to say/remember.","Cooperative","none"
"Good example of a generic name being a shortened chemical compound name is dexamphetamine. The chemical compound is DEXtro-Alpha-Methyl-PHenyl-EThyl-AMINE, combine all the capital letters and you get DEXAMPHETAMINE. Brand names of this is things like Dexedrine or Adderall* (* Adderral is combination of dexamphetamine and other amphetamine salts)","The “generic” name is the actual name (or sometimes a shortened version) of the chemical compound that makes up the medication.   The brand name is a marketing name invented by the pharmaceutical company that patented it that’s easier to say/remember.","Cooperative","none"
"I will never in a million years understand why they chose ""Skyrizi""  I will never take that seriously","The “generic” name is the actual name (or sometimes a shortened version) of the chemical compound that makes up the medication.   The brand name is a marketing name invented by the pharmaceutical company that patented it that’s easier to say/remember.","Quality","flouting"
"fukitol®, for when life gets too much.","The “generic” name is the actual name (or sometimes a shortened version) of the chemical compound that makes up the medication.   The brand name is a marketing name invented by the pharmaceutical company that patented it that’s easier to say/remember.","Quality","flouting"
"I always wonder what sitting in on those meetings where they decide the brand name would be like.     ""What about Volverica?""    ""Nahh, too proto-dynamic... How about Vorverica?""    ""....shit, that's good.","The generic name is for things like science and research where as the brand name is tied to things like marketing and branding.","Manner","flouting"
"Except in the weird case of acetaminophen and paracetamol.","Generic names follow the rules of the [international nonproprietary name](https://en.wikipedia.org/wiki/International_nonproprietary_name) system created by the WHO. They are created from a system of stems and affixes according to the drug's use and chemical properties, e.g. the suffix ""-caine"" is used for local anaesthetics and ""-vir"" is used for antivirals.","Cooperative","none"
"Tylenol is the household name, but I’d say 99% of people say ibuprofen instead of Advil.","Same thing as with Kleenex and tissue. The generic name is tissue, but many people say Kleenex because it’s become so common. Most people don’t ask for acetaminophen or ibuprofen. They ask for Tylenol or Advil, even though they don’t really care about the brand","Cooperative","none"
"Which browsers save autofill passwords in plaintext?","Auto fill is less safe because it means your password is saved in plain text somewhere on your computer and labelled as being for the site  An actual password manager would encrypt them","Relation","flouting"
"A password manager saves password encrypted, sure it's temporary decrypted in memory in order autofill on the form, but if you manually type a password into field that's also true.","Auto fill is less safe because it means your password is saved in plain text somewhere on your computer and labelled as being for the site  An actual password manager would encrypt them","Cooperative","none"
